{
  "manifestVersion": "1.0",
  "id": "founder-scout",
  "displayName": "Founder Scout",
  "description": "Captures, evaluates, and drafts introductions for startup founder profiles without sending invitations.",
  "version": "1.5.0",
  "executable": "FounderScout.exe",
  "supportedCommands": [
    "run",
    "discover",
    "analyze",
    "authenticate",
    "import",
    "report",
    "diagnose",
    "record-fixture"
  ],
  "capabilities": [
    "fixture-import",
    "profile-capture",
    "playwright-browser-discovery",
    "persistent-browser-profiles",
    "manual-browser-authentication",
    "browser-diagnostics",
    "durable-discovery-checkpoints",
    "candidate-persistence",
    "normalized-profile-processing",
    "protected-attribute-redaction",
    "deterministic-fast-screening",
    "candidate-deduplication",
    "durable-processing-leases",
    "structured-ai-evaluation",
    "deterministic-candidate-scoring",
    "evidence-grounding-validation",
    "evaluation-input-caching",
    "human-review-invitation-drafts",
    "immutable-draft-revisions",
    "manual-invitation-queue",
    "manual-outcome-tracking",
    "candidate-results-ui",
    "safe-multiformat-reporting",
    "raw-artifact-retention",
    "domain-diagnostics"
  ],
  "defaultTimeoutSeconds": 3600,
  "defaultConcurrencyPolicy": "Forbid",
  "supportsScheduling": true,
  "supportsManualRun": true,
  "requiresInteractiveUserSession": true,
  "configurationSchemaVersion": "1.0"
}
